[
  {
    "timestamp": "2025-07-01T12:30:00Z",
    "source": "peer_endorsement",
    "trait": "integrity",
    "delta": 0.02,
    "domain": "law",
    "cohort_id": "law-2025-Q3",
    "validator_id": "did:validator:0xABC"
  },
  {
    "timestamp": "2025-07-02T09:00:00Z",
    "source": "task_outcome",
    "trait": "intent_alignment",
    "delta": -0.01,
    "domain": "governance",
    "cohort_id": "gov-2025-Q3"
  }
]